"id","text","date","truthRating","ratingName","author","headline","named_entities_claim","named_entities_article","keywords","source","sourceURL","link","language"
"http://data.gesis.org/claimskg/claim_review/8d85da51-5e36-5bef-9a68-3a2d3ad2daef","Human trafficking rings are using job interviews to lure college students.","Unknown",1,"FALSE","Unknown","Summer Job Interview or Human Trafficking Front?","BuzzFeed,Cutco,Cutco Cutlery,Facebook,Fresno, California,Hobby Lobby,Humble, Texas,Jesse James,LGBTQ,Mike Flynt,Nixa, Missouri,Polaris Project,Southwestern Advantage,Twitter,Your Houston News,domestic violence,human trafficking,labor trafficking in the United States,runaways,sex trafficking,sexual assault,that that,tumblr","Human trafficking","human trafficking","snopes","http://www.snopes.com","https://www.snopes.com/fact-check/interview-for-trafficking/","English"
"http://data.gesis.org/claimskg/claim_review/453959b9-0558-5588-808a-f8c0fc9ce4bd","'Two million more people just dropped out of Obamacare. It is in a death spiral.'",2017-06-13,2,"MIXTURE","Donald Trump","Donald Trump's Mostly False tweet about Obamacare dropouts","Affordable Care Act,American Health Care Act,Centers for Medicare and Medicaid Services,Congressional Budget Office,Donald Trump,Medicaid,Medicare,Vanderbilt University,data activist,just dropped,state, people","Two million,just dropped","Health Care","politifact","http://www.politifact.com","http://www.politifact.com/truth-o-meter/statements/2017/jun/14/donald-trump/trump-wrongly-ties-flawed-obamacare-data-death-spi/","English"
"http://data.gesis.org/claimskg/claim_review/a2619dc9-15d3-5d37-aed7-3b889a2442c5","It’s free to watch TV in prison.","Unknown",-1,"OTHER","Unknown",,"","","Home,Crime,The state of prisons","fullfact","http://fullfact.org/","https://fullfact.org/health/cost-tv-hospital-prison/","English"
"http://data.gesis.org/claimskg/claim_review/2c62e061-443b-528a-89a9-986a24da14f2","Nine of the ten most deprived council areas in this country have seen cuts that are almost three times the average of any other council.","Unknown",-1,"OTHER","Unknown",,"","","Home,Economy,Comparing UK regions","fullfact","https://fullfact.org/","https://fullfact.org/economy/have-most-deprived-councils-seen-biggest-reductions-funding/","English"
"http://data.gesis.org/claimskg/claim_review/ea94df17-55ab-5eb4-a72f-e217352d1a38","'New Jersey's governor cut $1.6 billion from public education while handing out $2.1 billion in corporate tax breaks, more than the entire previous decade.'",2013-04-30,2,"MIXTURE","AFL-CIO of New Jersey","NJ AFL-CIO claims Chris Christie cut education funding by $1.6B while giving out $2B in corporate tax breaks","AFL-CIO,Chris Christie,Drewniak,Facebook,Kevin Roberts,Michael Drewniak,NJ.com,attack ad,but not,think tank","","Corporations,Education,State Budget,State Finances","politifact","http://www.politifact.com","http://www.politifact.com/new-jersey/statements/2013/may/23/new-jersey-state-afl-cio/afl-cio-claims-chris-christie-cut-ed-funding-16b-w/","English"
"http://data.gesis.org/claimskg/claim_review/4ed05ab9-ea89-5055-a98e-efbdc62a1056","Says people who signed recall petitions against Wisconsin state Sen. Jim Holperin received 'harassing phone calls from out-of-state telemarketers claiming to represent the Democratic Party and insinuating foul play by petition circulators.'",2011-04-29,3,"TRUE","Kim Simac","Wisconsin tea party leader says Democrat-hired telemarketer called recall petition signers","Democrat,Eagle River,Jim Holperin,PolitiFact,Republican,Republican Party,Scott Walker,St. Cloud, Minn,Vilas County,Wisconsin,collective bargaining,recall election,what you’re","Jim Holperin","Elections,State Budget","politifact","http://www.politifact.com","http://www.politifact.com/wisconsin/statements/2011/may/18/kim-simac/wisconsin-tea-party-leader-says-democrat-hired-tel/","English"
"http://data.gesis.org/claimskg/claim_review/bb4921bd-aca3-5dbc-895f-4f70a7cbeef9","iPhone users can access emergency services simply by tapping the Lock button of their device five times.","Unknown",2,"MIXTURE","Unknown","Can You Access Emergency Services by Pressing an iPhone’s Lock Button Five Times?","Apple Support,Facebook,Touch ID,iOS 11,iPhone,iPhone 5,iPhone 7,iPhone 8 Plus,iPhone X,operating system,slider,time after","iPhone","911 calls, Emergency SOS in iOS 11, iphone, iphone hacks, iphone SOS, safety rumors, Safety Zone","snopes","http://www.snopes.com","https://www.snopes.com/fact-check/iphone-sos/","English"
"http://data.gesis.org/claimskg/claim_review/e416efdb-20e1-52ba-a181-cf6dd02fb13a","A photograph shows an anti-fascist protester duct-taped to an electrical box by neo-Nazis.","Unknown",1,"FALSE","Unknown","Did ‘Nazis’ Tape an Antifa Member to a Utility Box?","Antifa,Instagram,antifa,m so,street art,the power","",,"snopes","http://www.snopes.com","https://www.snopes.com/fact-check/duct-tape-antifa/","English"
"http://data.gesis.org/claimskg/claim_review/431bdb02-b447-509d-a615-f75aa65137e5","TLC's Lisa 'Left-Eye' Lopes was murdered in a revenge killing.","Unknown",1,"FALSE","Unknown","Was Lisa Lopes Murdered?","FanMail,Honduras,Lisa Lopes,Lisa “Left Eye” Lopes,Mitsubishi Montero,San Pedro Sula,TLC,blunt head trauma,infant carrier,the keys","Lopes,TLC","Artists, music","snopes","http://www.snopes.com","https://www.snopes.com/fact-check/lisa-lopes/","English"
"http://data.gesis.org/claimskg/claim_review/eabed287-a96a-56e6-823a-f66df26bb134","A roofer who foolishly ties his safety rope to the bumper of his wife’s car is dragged off the roof and down the street.","Unknown",1,"FALSE","Unknown","Dragged Roofer","Vanishing Hitchhiker,Weekly World News,a man,man on the roof,urban legend","","ASP Article, Motoring Mishaps","snopes","http://www.snopes.com","https://www.snopes.com/fact-check/man-over-clapboard/","English"
"http://data.gesis.org/claimskg/claim_review/c13c6dcc-15bd-5aec-ab61-c8ef9baa33c4","'Over the last 40 years, real wage growth has been flatlined because of the policies of the Federal Reserve ... It was all driven by the Federal Reserve.'",2014-08-11,2,"MIXTURE","Herman Cain","Herman Cain says wages flat thanks to the Federal Reserve","2012 Republican presidential candidate,American Enterprise Institute,Barack Obama,Bill Clinton,CPI,Consumer Price Index,Economic Policy Institute,Fox News Business,Harvard University,Heritage Foundation,Herman Cain,Interest rate,John Makin,Kenneth Rogoff,Labor Economics,Mark Bils,Robert Reich,Stephen Moore,Stuart Varney,University of California, Berkeley,University of Rochester,congressional Joint Economic Committee,economist,exchange value,federal minimum wage,gold exchange standard,human capital,income inequality,income tax,inflation,interest rate,labor economics,labor economist,liberal,minimum wage,monetary policy,real wage,s more,the price,think tank,us us","real wage","Economy,Workers","politifact","http://www.politifact.com","http://www.politifact.com/punditfact/statements/2014/aug/26/herman-cain/herman-cain-says-wages-flat-thanks-federal-reserve/","English"
"http://data.gesis.org/claimskg/claim_review/b36bb1ab-49e1-58fb-91b8-d437b3d7a636","'We need an ID' to 'buy a beer.'",2018-08-12,2,"MIXTURE","Brad Schimel","Despite Brad Schimel's claim, in Wisconsin you don't need an ID to buy a beer like you do to vote","2016 presidential election,Brad Schimel,Department of Justice,Facebook,PolitiFact,Republican,Twitter,https,to show,twitter","","Alcohol,Elections,Legal Issues","politifact","http://www.politifact.com","http://www.politifact.com/wisconsin/statements/2018/aug/22/brad-schimel/despite-brad-schimels-claim-wisconsin-you-dont-nee/","English"
"http://data.gesis.org/claimskg/claim_review/fbd77ecd-3dd1-5cee-b6eb-f6d4a3edd748","'Today, Florida is in 50th place in spending on education.'",2010-07-07,2,"MIXTURE","Bud Chiles","Chiles needs schooling on education rankings","Education Week,Florida Department of Education,Florida Legislature,Institute of Education Sciences,Miami Herald,National Center for Education Statistics,National Education Association,So you,U.S. Census Bureau,Utah,Washington, D.C,dead-last,s more","","Education","politifact","http://www.politifact.com","http://www.politifact.com/florida/statements/2010/jul/07/bud-chiles/chiles-needs-schooling-education-rankings/","English"
"http://data.gesis.org/claimskg/claim_review/8d5baf12-87d0-5035-9b75-f00e3e1fcb53","Says Mitch McConnell voted 'three times for corporate tax breaks that send Kentucky jobs overseas.'",2014-08-15,2,"MIXTURE","Alison Lundergan Grimes","Alison Lundergan Grimes ad says Mitch McConnell voted for corporate tax breaks for outsourcing","Alison Lundergan Grimes,Bring Jobs Home Act,Internal Revenue Service,Joint Committee on Taxation,Kentucky,Mitch McConnell,Office of Management and Budget,Offshoring,Tax Policy Center,University of Michigan","Mitch McConnell","Corporations,Message Machine 2014,Taxes,Voting Record,Wealth","politifact","http://www.politifact.com","http://www.politifact.com/truth-o-meter/statements/2014/sep/12/alison-lundergan-grimes/alison-lundergan-grimes-ad-says-mitch-mcconnell-vo/","English"
"http://data.gesis.org/claimskg/claim_review/40ed1948-29fd-5ee4-a334-892813892528","Dr. Anne Wortham wrote “No He Can’t,” an editorial critical of Barack Obama.","Unknown",-1,"OTHER","Unknown","Anne Wortham — No He Can’t","Barack Obama,Hoover Institution,Illinois State University,Stanford University","Barack Obama","ASP Article","snopes","http://www.snopes.com","https://www.snopes.com/fact-check/no-he-cant/","English"
"http://data.gesis.org/claimskg/claim_review/7904c3c8-568e-51e5-b9ba-e816a60f2ab1","Says there were over 600 reports of Texas votes for Donald Trump in the state’s 2016 Republican primary virtually all getting tallied for Marco Rubio.",2016-04-06,1,"FALSE","Committee to Restore America's Greatness","Pants on Fire: Claim there were over 600 reports of Trump votes getting counted for Marco Rubio","2016 Republican National Convention,Arizona,Colorado,Dallas County,Donald J. Trump,Donald Trump,Frank Luntz,Hawaii,InfoWars.com,Iowa,James Dickey,John Kasich,Maine,Marco Rubio,Mike Joyce,New Yorker,Oklahoma,PolitiFact,Republican,Republican Party of Texas,Reuters,Roger Stone,Security Project,Ted Cruz,Texas,Texas secretary of state,Travis County,Utah,Wisconsin,security project,super PAC,the chairman","2016 Republican primary,Donald Trump,Marco Rubio,Republican,Texas","Elections","politifact","http://www.politifact.com","http://www.politifact.com/texas/statements/2016/apr/11/committee-restore-americas-greatness/pants-fire-claim-there-were-over-600-reports-trump/","English"
"http://data.gesis.org/claimskg/claim_review/f6c1400e-594b-581f-8dbd-d2233bb5df32","Donald Trump intervened to stop a bat-wielding mugger in New York City in 1991.","Unknown",-1,"OTHER","Unknown","Did Donald Trump Stop a Mugging in 1991?","Donald Trump,Google Trends,MARK SIMONE,Marjory Stoneman Douglas High School,Marla Maples,NEW YORK — Call,New York City,New York Times,Parkland, Fla,Paula Abdul,State Dining Room,Vietnam War,White House,a man,assault weapon,at me,daredevil,https,mass shooting,play this thing,twitter","Donald Trump,New York City","donald trump","snopes","http://www.snopes.com","https://www.snopes.com/fact-check/trump-stops-mugging-1991/","English"
"http://data.gesis.org/claimskg/claim_review/08b6b991-df81-5dd0-a297-b574ddba6641","Hillary Clinton used a green screen to add fake audience members during her August 2016 speech in Nevada.","Unknown",1,"FALSE","Unknown","Hillary Clinton Used Green Screen to Make a Fake Crowd in Nevada","Barry Soetoro,Hillary Clinton,YouTube,green screen,no mob","Hillary Clinton","clinton, clinton green screen, green screen, hillary clinton, nevada, politics","snopes","http://www.snopes.com","https://www.snopes.com/fact-check/hillary-clinton-used-green-screen-to-make-a-fake-crowd-in-nevada/","English"
"http://data.gesis.org/claimskg/claim_review/c4499016-b3d4-543d-bd92-402797c3fb8d","The PGA officially has changed the golf term 'a bad lie' to 'a Hillary' in honor of Arnold Palmer.","Unknown",1,"FALSE","Unknown","A Bad Lie","Arnold Palmer,Golf Glossary,a bad,a “bad,jape","Arnold Palmer,a bad","arnold palmer, hillary clinton, pga","snopes","http://www.snopes.com","https://www.snopes.com/fact-check/bad-lie-golf-joke/","English"
"http://data.gesis.org/claimskg/claim_review/28953e67-6f97-5cbe-9f0b-4f83435e14a2","A photograph shows two people with the darkest and lightest skin colors in the world.","Unknown",1,"FALSE","Unknown","Image of ‘Lightest and Darkest Skin Colors’","Papis Loveday,Shaun Ross","","darkest, lightest, People, skin color","snopes","http://www.snopes.com","https://www.snopes.com/fact-check/lightest-darkest-skin-colors/","English"
"http://data.gesis.org/claimskg/claim_review/f9788b56-c2da-59b5-acf6-348e2c7fcc0b","An extension to Brexit would cost the UK £1 billion a month","Unknown",-1,"OTHER","Unknown",,"","Brexit","Home,Europe,Brexit negotiations","FullFact","https://fullfact.org/","https://fullfact.org/europe/brexit-extension-1-billion/","English"
"http://data.gesis.org/claimskg/claim_review/ff7dbe69-23d9-52b4-b1a0-026bf75b8e58","Says Donald Trump's presidential victory was 'an electoral landslide.'",2016-11-14,1,"FALSE","Reince Priebus","Despite losing popular vote, Donald Trump won in 'electoral landslide,' GOP's Reince Priebus says","ABC,Associated Press,Barack Obama,Boston University,Brit Hume,Bruce Schulman,Costas Panagopoulos,Donald Trump,Electoral College,Fordham University,Fox News,Good Morning America,Herb Asher,Hillary Clinton,Jimmy Carter,John F. Kennedy,John Woolley,Jonah Goldberg,Kellyanne Conway,Larry Sabato,Newt Gingrich,Ohio State University,Paul Ryan,PolitiFact,Political Wire,Politico,Politifact,Reince Priebus,Republican National Committee,Sabato’s Crystal Ball,Social Science Research Council,Taegan Goddard,University of California, Santa Barbara,University of Virginia,University of Wisconsin-Madison,conservative,political science,sign, seal","Donald Trump","Elections,History,States","politifact","http://www.politifact.com","http://www.politifact.com/wisconsin/statements/2016/nov/21/reince-priebus/despite-losing-popular-vote-donald-trump-won-elect/","English"
"http://data.gesis.org/claimskg/claim_review/0289e122-c325-5952-9d4d-a6ce086bd549","'Kim Jong Un dead: North Koreans calling Trump an assassin'",2017-07-06,1,"FALSE","Bloggers","It's fake news that an American killed North Korea's leader Kim Jong Un","Alaska,American sniper,CNN,Democratic People's Republic of Korea,Fake News,Hawaii,Iraq,Kim Jong Un,Korean Central News Agency,Kumsusan Palace of the Sun,North Korea,PolitiFact,Pyongyang,Saddam Hussein,United Press International,fake news,intercontinental ballistic missile,sniper rifle","Kim Jong Un","Fake news,Foreign Policy","politifact","http://www.politifact.com","http://www.politifact.com/punditfact/statements/2017/jul/20/blog-posting/its-fake-news-american-killed-north-koreas-leader-/","English"
"http://data.gesis.org/claimskg/claim_review/8f365d32-4edc-5fda-9c50-825f55741421","A nurse employed in a Zambian hospital swapped nearly 5,000 babies at birth and gave them to the 'wrong' parents.","Unknown",1,"FALSE","Unknown","Did a Maternity Ward Nurse Switch 5,000 Babies at Birth for ‘Fun’?","Columbus, Ohio,I am really sorry,Lusaka,Lusaka Times,Mwewa,Ndola,Zambia,habbit,switched at birth,that that","","zambian observer","snopes","http://www.snopes.com","https://www.snopes.com/fact-check/zambia-nurse-swap-babies/","English"
"http://data.gesis.org/claimskg/claim_review/5cb184bf-95d9-506a-aef5-0565cbe3dc8e","Anyone who bought milk after 2003 can be compensated under the terms of a class action lawsuit.","Unknown",-1,"OTHER","Unknown","Is Everyone Who Bought Milk Since 2003 Covered Under a Class Action Settlement?","Arizona,California,Class Action,Class action,Compassion Over Killing,Dairy Farmers of America,DairyLea,DairyLea Cooperative,District of Columbia,Hagens Berman Sobol Shapiro,Huffington Post,Kansas,Land O’ Lakes,Massachusetts,Michigan,Missouri,Nebraska,Nevada,New Hampshire,Oregon,South Dakota,Tennessee,Vermont,West Virginia,Wisconsin,class action,cottage cheese,cream cheese,half & half,sour cream,yogurt","class action","boughtmilk.com, Class Action Lawsuits, dairy industry, milk","snopes","http://www.snopes.com","https://www.snopes.com/fact-check/milk-class-action-lawsuit-settlement/","English"
"http://data.gesis.org/claimskg/claim_review/dfcc47d6-c9ee-50ef-842a-ccb4a76bbf2f","A woman stuck to a toilet seat provides a physician with an opportunity for the perfect bon mot.","Unknown",1,"FALSE","Unknown","Woman Stuck to Painted Toilet Seat","Associated Press,Commerce, Georgia,Home Depot,Loctite,Louisville, Colorado,Nederland, Colorado,Playboy,Rationale of the Dirty Joke,Rocky Mountain News,paper sack","","ASP Article, Oddities","snopes","http://www.snopes.com","https://www.snopes.com/fact-check/frame-job/","English"
"http://data.gesis.org/claimskg/claim_review/b4906de2-c57d-5e9b-8ada-fe342c974b8b","Chrysler dealerships owned by Republican donors were disproportionately targeted for closure at the behest of the Obama administration.","Unknown",1,"FALSE","Unknown","Steve Rattner – Car Czar","Barack Obama,Chrysler,FOX News,FOXNews,FOXNews.com,FiveThirtyEight,Macomb County,Macomb County, Michigan,Macomb Daily,Obama administration,Republican,Silver, Nate,Washington Examiner","Chrysler,Obama administration,Republican","ASP Article","snopes","http://www.snopes.com","https://www.snopes.com/fact-check/car-czar/","English"
"http://data.gesis.org/claimskg/claim_review/74ed59e5-6428-5811-9188-a6798b597a33","Snapchat is using its 'Lenses' photo and video filtering technology to create a facial recognition database for use by law enforcement agencies.","Unknown",1,"FALSE","Unknown","Is Snapchat Building a Facial Recognition Database for the Feds?","Al Franken,Alison Booth,Biometric Information Privacy Act,CIA,Chrissy Teigen,Electronic Frontier Foundation,FBI,Facebook,Georgetown Law Center,Government Accountability Office,Instagram,Jennifer Lynch,Privacy Center,Snap Inc,Snapchat,Sophos,biometrics,class action,consumer privacy,facial recognition technology,snap chat,snapchat,to show,two million,video filters","Snapchat","facial recognition, fbi, privacy, snapchat","snopes","http://www.snopes.com","https://www.snopes.com/fact-check/snapchat-facial-recognition/","English"
"http://data.gesis.org/claimskg/claim_review/091462d8-190b-5b39-a7c8-b5724844bc1e","'There is a big correlation between third grade reading level and whether you go to college or whether you go to prison. And in Florida right now only 56 percent of kids are coming out of third grade at third grade reading level.'",2018-07-29,2,"MIXTURE","Jeff Greene","3rd-grade reading stats from Jeff Greene, FL Dem candidate for governor, mostly hold up","Annie E. Casey Foundation,It’s spooky,Jeff Greene,Katharine Abraham,Northeastern University,PolitiFact,University of Chicago,University of Maryland,a man,argues,https,office, students","","Crime,Education","politifact","http://www.politifact.com","http://www.politifact.com/florida/statements/2018/aug/07/jeff-greene/greenes-third-grade-statistics-mostly-hold/","English"
"http://data.gesis.org/claimskg/claim_review/3f9b565c-f53c-5b6d-ac7c-6bfdfb515e22","'Fifty percent of Speaker Gingrich’s tax plan goes to the top 1 percent.'",2011-12-20,2,"MIXTURE","Barack Obama","Obama campaign says half of the benefit from Newt Gingrich's tax plan goes to top 1 percent","Barack Obama,Bush-era tax cuts,CNN,CNN Money,Cato Institute,Chris Edwards,Herman Cain,Newt Gingrich,Obama administration,Occupy Wall Street,Republican,Rick Perry,Tax Policy Center,flat tax,income tax,libertarian,t stop,top 1 percent of income earners","","New Hampshire 2012,Taxes","politifact","http://www.politifact.com","http://www.politifact.com/truth-o-meter/statements/2011/dec/28/barack-obama/obama-campaign-says-half-benefit-newt-gingrichs-ta/","English"
"http://data.gesis.org/claimskg/claim_review/f93578ab-d289-5b66-a6f9-606cd449aa7b","'As speaker, Gingrich even supported taxpayer funding of some abortions.'",2011-12-20,2,"MIXTURE","Restore Our Future","Ad claims Newt Gingrich favored federal funding for some abortions","Barack Obama,CBS,Des Moines Register,District of Columbia,Face the Nation,Gloria Borger,Henry Hyde,Hyde Amendment,Iowa caucuses,Medicaid,Mitt Romney,NARAL Pro-Choice America,National Right to Life Committee,Newt Gingrich,Pro-Life,R.C. Hammond,Republican,Restore our Future,Susan B. Anthony List,U.S. News and World Report,YouTube,abortion,abortion rights,baggage carousel,incest,political action committee,super PAC","","Abortion,Message Machine 2012","politifact","http://www.politifact.com","http://www.politifact.com/truth-o-meter/statements/2011/dec/27/restore-our-future/ad-claims-gingrich-favored-federal-funding-some-ab/","English"
"http://data.gesis.org/claimskg/claim_review/3242f739-bba1-56d8-80d7-2e8b18b1d665","Obama has 'visited more countries and met with more world leaders than any president in his first six months in office.'",2009-11-19,3,"TRUE","Chain email","Chain e-mail claims Obama has visited more countries in first six months of presidency than predecessors","Barack Obama,Bill Clinton,Brendan Doherty,CBS News,George H.W. Bush,George W. Bush,Jimmy Carter,Lynn University,Mark Knoller,Obama administration,Panama,Ronald Reagan,Theodore Roosevelt,U.S. Department of State,U.S. Naval Academy,White House,achain,dataon,s international","","Foreign Policy","politifact","http://www.politifact.com","http://www.politifact.com/truth-o-meter/statements/2009/nov/20/chain-email/chain-e-mail-claims-obama-has-visited-more-countri/","English"
"http://data.gesis.org/claimskg/claim_review/6969e6c3-0068-56b9-bdb9-ded248b9cb6a","Image reproduces women’s housekeeping and grooming instructions from a 1949 Singer sewing manual.","Unknown",3,"TRUE","Unknown","Advice from a 1949 Singer Sewing Manual","Mary Brooks Picken,Singer Sewing Machine Company,needlework,textile arts","","ASP Article, Documents","snopes","http://www.snopes.com","https://www.snopes.com/fact-check/sewing-discontent/","English"
"http://data.gesis.org/claimskg/claim_review/0c5de4b7-8c5e-5e8b-a5f6-413b8bb2f186","Says U.S. Rep. Ann McLane Kuster used $293,000 of taxpayer money to send campaign mail.",2014-06-27,2,"MIXTURE","Marilinda Garcia","GOP challenger Marilinda Garcia says U.S. Rep. Kuster used taxpayer funds for campaign mail","Ann McLane Kuster,Charles Bass,Committee on House Administration,Democrat,Marilinda Garcia,Medicare,New Hampshire,New Hampshire Union Leader,New Hampshire’s 2nd Congressional District,PolitiFact,Republican,Social Security,Washington D.C,argues,franked mail,franking privilege,job fair,logos and slogans,personal pronoun,robocall,the ring","Ann McLane Kuster","Campaign Finance,Ethics","politifact","http://www.politifact.com","http://www.politifact.com/new-hampshire/statements/2014/aug/04/marilinda-garcia/gop-challenger-marilinda-garcia-says-us-rep-kuster/","English"
"http://data.gesis.org/claimskg/claim_review/97ed2c15-3590-58e4-b0db-01d91d1d11cd","A photograph shows a new home invasion technique featuring rubber bands and door handles.","Unknown",-1,"OTHER","Unknown","Robbers Using Rubber Bands to Break Into Houses?","Bossier, Louisiana,FYI,Facebook,Tatum, Texas,a man,at my front door,but not,time you","","crime warnings, home invasion, rubber bands","snopes","http://www.snopes.com","https://www.snopes.com/fact-check/rubber-band-home-invasion-warning/","English"
"http://data.gesis.org/claimskg/claim_review/1f1c1bb2-e446-5301-b597-d189561bb7b0","Three Syrian refugees raped and murdered a 5-year-old girl at knifepoint in Idaho.","Unknown",2,"MIXTURE","Unknown","Three Syrian Refugees Assault 5-Year-Old Girl at Knifepoint?","Idaho,KMVT,Magic Valley,Twin Falls County,Twin Falls council,Twin Falls, Idaho,disturbing case","Idaho","idaho, infowars, mad world news, syrian children, syrian refugees, twin falls","snopes","http://www.snopes.com","https://www.snopes.com/fact-check/three-syrian-refugees-assault-5-year-old-girl-at-knifepoint/","English"
"http://data.gesis.org/claimskg/claim_review/798cd81f-fd24-5317-bd4e-b79c0283748f","Senator Ted Cruz claimed flooding in Texas was caused by Native American rain dances.","Unknown",1,"FALSE","Unknown","Ted Cruz: The Texas Floods Were Caused by Native American Rain Dances","Native American,Rain Dances,Ted Cruz,Twitter,fake news,fake news sites,rain dances,the “rain","Native American,Ted Cruz,Texas,rain dances","ASP Article, Not Necessarily The News","snopes","http://www.snopes.com","https://www.snopes.com/fact-check/rain-schtick/","English"
"http://data.gesis.org/claimskg/claim_review/243a5b52-806f-5134-aad5-2801990c4d82","'22 veterans take their own lives each day.'",2016-08-18,2,"MIXTURE","Kamala Harris","Kamala Harris slightly off in claim about veterans suicides","California Attorney General,Capital Public Radio,Donald Trump,Kamala Harris,Loretta Sanchez,PolitiFact,Twitter,U.S. Department of Veterans Affairs,U.S. Representative,U.S. Senate,Washington Post,deaths in 21,matter of life and death,run for U.S. Senate","","Veterans","politifact","http://www.politifact.com","http://www.politifact.com/california/statements/2016/aug/23/kamala-harris/kamala-harris-slightly-claim-about-veterans-suicid/","English"
