"id","text","date","truthRating","ratingName","author","headline","named_entities_claim","named_entities_article","keywords","source","sourceURL","link","language"
"http://data.gesis.org/claimskg/claim_review/121594f8-478c-50ef-98bf-6b7d0c490c10","Ulta Beauty will close its doors following a buyout by competitor Sephora.","Unknown",1,"FALSE","Unknown","Is Ulta Closing After a Sephora Buyout?","Sephora,Ulta Beauty","Sephora,Ulta Beauty","fake news ads, sephora, ulta","snopes","http://www.snopes.com","https://www.snopes.com/fact-check/ulta-closing-sephora-buyout/","English"
"http://data.gesis.org/claimskg/claim_review/f2c0df99-e911-5bff-80e6-96a04a8f8543","The USA is the largest investor in the UK economy.","Unknown",-1,"OTHER","Unknown",,"","","Home,Economy","fullfact","http://fullfact.org/","https://fullfact.org/economy/uk-us-trading-and-investment/","English"
"http://data.gesis.org/claimskg/claim_review/7e1acf63-3f89-58b1-852f-224b85d68153","Louisiana’s film incentives program is so big 'they actually shot an upcoming film initially titled ‘Don’t Mess With Texas’ in New Orleans!'",2015-01-24,2,"MIXTURE","Paul Stekler","Paul Stekler says Louisiana's rich incentives caused a 'Texas' movie to be made in New Orleans","Austin American-Statesman,Don't Mess With Texas,Don’t Mess With Texas,Greg Abbott,IMDb,Internet Movie Database,Louisiana,Neaux,New Orleans,New Orleans Times-Picayune,New Orleans!'Louisiana,Paul Stekler,PolitiFact,Reese Witherspoon,Sofia Vergara,Texas Film Commission,Texas Killing Fields,Times-Picayune","Don’t Mess With Texas,New Orleans","State Budget,State Finances,Taxes","politifact","http://www.politifact.com","http://www.politifact.com/texas/statements/2015/feb/07/paul-stekler/paul-stekler-says-louisiana-incentives-best-nation/","English"
"http://data.gesis.org/claimskg/claim_review/e427ee15-3eae-59f9-8784-a526e2783cb2","'To this day, (the Cuban government) is a regime that provides safe harbor to terrorists and fugitives.'",2016-03-17,2,"MIXTURE","Paul Ryan","Paul Ryan says Cuba is a 'safe harbor' for fugitives and terrorists","Armed Forces of National Liberation,Barack Obama,Basque Fatherland and Liberty,Black Liberation Army,Brookings Institution,Cold War,Congressional Research Service,Cuba,Cuban exile,Florida International University,Luis Posada Carriles,Obama administration,Palestinian Liberation Organization,Paul Ryan,Revolutionary Armed Forces of Colombia,Soviet Union,Western Hemisphere,counterterrorism,state sponsor of terrorism,state sponsors of terrorism,terrorist financing,to return,to show","","Foreign Policy,Terrorism","politifact","http://www.politifact.com","http://www.politifact.com/truth-o-meter/statements/2016/mar/24/paul-ryan/paul-ryan-says-cuba-safe-harbor-fugitives-and-terr/","English"
"http://data.gesis.org/claimskg/claim_review/c50c4c70-ef62-5a45-ad25-9d01e4493af7","Says 'new estimates from the Congressional Budget Office conclude the final price-tag' for the health care law 'will exceed $2 trillion — more than double what was initially reported.'",2012-03-19,1,"FALSE","Frank LoBiondo","Frank LoBiondo says health care reform law will cost more than twice the original estimate","Congressional Budget Office,Frank LoBiondo,Galanes,NJ.com,New Jersey,News of Cumberland County,PolitiFact,Republican,U.S. Supreme Court","Congressional Budget Office","Health Care","politifact","http://www.politifact.com","http://www.politifact.com/new-jersey/statements/2012/apr/01/frank-lobiondo/frank-lobiondo-says-health-care-reform-law-will-co/","English"
"http://data.gesis.org/claimskg/claim_review/dec75b74-64c5-5967-89fd-d05ea42ddd1a","Based on information he learned from library books, school drop-out William Kamkwamba built a windmill out of scrap parts and brought electricity to his village in Malawia.","Unknown",3,"TRUE","Unknown","The Boy Who Harnessed the Wind","African Leadership Academy,Daily Show,Daily Show with Jon Stewart,Dartmouth College,Dowa, Malawi,Internet meme,Johannesburg,Malawi,South Africa,TED conference,Tanzania,Wall Street Journal,William Kamkwamba,bicycle dynamo,bicycle frame,bicycle wheel,circuit breaker","William Kamkwamba","william kamkwamba","snopes","http://www.snopes.com","https://www.snopes.com/fact-check/william-kamkwamba/","English"
"http://data.gesis.org/claimskg/claim_review/065f6bed-27c2-5551-825e-ebafa26ed261","A video shows Paul George's jersey number changing from 13 to 14 after he performed a 360 dunk.","Unknown",-1,"OTHER","Unknown","Did Paul George’s Jersey Number Change After He Executed a 360 Dunk?","2019 NBA All-Star game,Adam Silver,Basketball,Oklahoma City Thunder,Paul George,YouTube,click to,to show,twitter","Paul George","Basketball","snopes","http://www.snopes.com","https://www.snopes.com/fact-check/paul-georges-number-change/","English"
"http://data.gesis.org/claimskg/claim_review/79baecd9-b0d5-5653-990d-feed42a8b5cc","Shock rise in heart disease deaths — Experts call for action after rates increase for first time in 50 years","Unknown",-1,"OTHER","Daily Express",,"","","['Home', 'Health', 'How healthy are we?']","fullfact","http://fullfact.org/","https://fullfact.org/health/heart-disease-death-rate/","English"
"http://data.gesis.org/claimskg/claim_review/0707cbb8-a8d3-5f79-aa4c-e560c7cb2489","Legislation currently under proposal would result in substantial cuts to federal funding of the NEA and other public arts programs.","Unknown",1,"FALSE","Unknown","Petition to Save the NEA","104th Congress,ABC,Bert and Ernie,Corporation for Public Broadcasting,Morning Edition,NPR,NetGuide,PBS,Sesame Street,South China Morning Post,St. Louis Post-Dispatch,USA Today,United Press International,Washington Post,anew,e-mail petition,full House,the Internet","","ASP Article, stephanie cegielski","snopes","http://www.snopes.com","https://www.snopes.com/fact-check/save-the-nea/","English"
"http://data.gesis.org/claimskg/claim_review/49827d32-f5c8-5680-8b59-f648107afbc3","Says 'taxes were raised 115 times in the eight years before I became governor' and those increases were part of a 'path that led to wealth and jobs and people leaving our state.'",2012-08-28,2,"MIXTURE","Chris Christie","Chris Christie claims in keynote address that taxes in New Jersey “were raised 115 times in eight years”","Chris Christie,NJ.com,PolitiFact,Republican,Republican National Convention,Tom Kean Jr,follow. Now,income tax,sales tax","","Taxes","politifact","http://www.politifact.com","http://www.politifact.com/new-jersey/statements/2012/aug/29/chris-christie/chris-christie-claims-keynote-address-taxes-new-je/","English"
"http://data.gesis.org/claimskg/claim_review/2abe0f0a-c00b-5daa-9911-c28f3c1d0bb6","Mark Warner voted for 'nearly $1 trillion in new taxes and $7 trillion in new debt.'",2014-01-16,3,"TRUE","Ed Gillespie","Gillespie says Warner voted for new taxes and more debt","Congressional Budget Office,Ed Gillespie,Federal Reserve,Mark Warner,Medicare,Patty Murray,Paul Logan,Republican,Senate Budget Committee,Treasury securities,U.S. Senate,national debt,public debt","Mark Warner","Debt,Federal Budget,Taxes,Voting Record","politifact","http://www.politifact.com","http://www.politifact.com/virginia/statements/2014/feb/10/ed-gillespie/gillespie-says-warner-voted-new-taxes-and-more-deb/","English"
"http://data.gesis.org/claimskg/claim_review/47304d8d-d445-5652-9da1-e525c9ffe841","Two claims on teen suicide in South Africa","Unknown",-1,"OTHER","Unknown","Teen suicide in South Africa: getting the facts right helps combat the problem | Africa Check","Africa Check,Daily Voice,Human Sciences Research Council,Linda Christensen,Medical Research Council,South Africa,South African Depression and Anxiety Group,Statistics South Africa,World Health Organization,World Mental Health Day,self-harm","South Africa","suicide rate, Teen suicide","africacheck","https://africacheck.org","https://africacheck.org/reports/teen-suicide-in-south-africa-getting-the-facts-right-helps-combat-the-problem/","English"
"http://data.gesis.org/claimskg/claim_review/e3051040-9236-5285-9921-6cd0a837a773","'We invested' in our transportation system '$24 billion over eight years. That’s $3 billion more than what former Governor Jim Doyle spent on transportation over the same period of time.'",2018-01-24,2,"MIXTURE","Scott Walker","Why Scott Walker, in real terms, has spent less on transportation than his Democratic predecessor","Democrat,Jim Doyle,PolitiFact,Republican,Scott Walker,Twitter,https,inflation","Jim Doyle","State Budget,State government spending ,Transportation","politifact","http://www.politifact.com","http://www.politifact.com/wisconsin/statements/2018/feb/06/scott-walker/why-scott-walker-real-terms-has-spent-less-transpo/","English"
"http://data.gesis.org/claimskg/claim_review/265c5343-b613-5ffa-8e61-72b880c4de69","Dropped food remains germ-free if picked up within five seconds.","Unknown",1,"FALSE","Unknown","Dropped Food Rule","5-Second Rule,Chicago High School for Agricultural Sciences,Dayton Daily News,E. coli,Houston Chronicle,Osmosis Jones,Pocket Books,Rocky Mountain News,Volkswagen Passat,bacteria,chimpanzee,eye. It,five second rule,five-second rule,one moment,ten second rule","","ASP Article, weather modification","snopes","http://www.snopes.com","https://www.snopes.com/fact-check/five-second-helpings/","English"
"http://data.gesis.org/claimskg/claim_review/92cb4297-6f0f-5669-9b96-28f8824501a8","Little girl Marian beaten to death by teacher",2019-05-09,-1,"OTHER","Gist Arena.NG","No, this little girl was not beaten to death by her teacher — she was hurt in a sledding accident","Facebook,Nairaland,girl who died,here, here and here,is alive,reverse image search,s pictures,social network,to show","",,"factcheck_afp","https://factcheck.afp.com/","https://factcheck.afp.com//no-little-girl-was-not-beaten-death-her-teacher-she-was-hurt-sledding-accident","English"
"http://data.gesis.org/claimskg/claim_review/c7a3287e-f1b1-5d03-b958-10c0b5914c1d","Says Republicans want to cut education by 25 percent.",2011-09-27,2,"MIXTURE","David Axelrod","Obama adviser Axelrod says Republican want deep education cuts","April, Ryan,Barack Obama,CBO,Congressional Budget Office,David Axelrod,House Budget Committee,Mitt Romney,New Hampshire,Paul Ryan,PolitiFact,Republican,Rick Perry,Ryan plan,Ryan proposal,St. Anselm College,White House,a man,apples to apples,total Function","","Education,Federal Budget,New Hampshire 2012","politifact","http://www.politifact.com","http://www.politifact.com/truth-o-meter/statements/2011/oct/17/david-axelrod/obama-adviser-axelrod-says-republican-want-deep-ed/","English"
"http://data.gesis.org/claimskg/claim_review/e85f2f96-2af3-5ce0-94b6-1431da4abcf4","Jason Kenney: 'This [Mediterranean] migration is not related to political problems in Libya.” - FactsCanada",2015-04-29,1,"FALSE","Jason Kenney","Jason Kenney: """"This [Mediterranean] migration is not related to political problems in Libya.” - FactsCanada","Central Mediterranean route,European Union,Evan Solomon,FactsCan,Frontex,Human Rights Watch,Jason Kenney,Libya,Moammar Gadhafi,North Africa,Syria,The New York Times,United Nations,human trafficking","Jason Kenney,Libya","CPC, Defence, Immigration, Jason Kenney","factscan","http://factscan.ca","http://factscan.ca/jason-kenney-mediterranean-migration/","English"
"http://data.gesis.org/claimskg/claim_review/e61d90ee-c8d5-5253-87bc-d6bf91ff3244","The striped mittenfish can change its sex by turning its entire body inside out.","Unknown",1,"FALSE","Unknown","Striped Mittenfish","I Have a Dream,Martin Luther King Jr,Wilbur Wright,the Internet","","ASP Article, Wild Inaccuracies","snopes","http://www.snopes.com","https://www.snopes.com/fact-check/striped-mittenfish/","English"
"http://data.gesis.org/claimskg/claim_review/9ff0a3e7-7ff9-5658-b53f-75e37a6d0746","Says 'thousands' at a Manhattan rally for Donald Trump were chanting 'We hate Muslims, we hate blacks, we want our great country back.'",2016-11-08,1,"FALSE","Social Media","No evidence to support rumors of 'We hate Muslims' chant at Trump victory rally","Buzzfeed,CBS,CNN,Donald Trump,Hampden Park,Katy Tur,Manhattan,Midtown Manhattan,NBC,New York Hilton,Old Trafford,Paul Pogba,Poe’s law,Rowntree’s,Sopan Deb,Twitter,golliwog","Donald Trump","Diversity,Islam","politifact","http://www.politifact.com","http://www.politifact.com/truth-o-meter/statements/2016/nov/09/social-media/no-evidence-support-rumors-we-hate-muslims-chant-t/","English"
"http://data.gesis.org/claimskg/claim_review/b6a16c1b-4821-58e2-9d60-ed2f3c0f6774","Says Sierra Club sued him to stop oil and gas activity on Texas coast, but 'we won' and 'the turtles are fine.'",2012-06-09,2,"MIXTURE","Jerry Patterson","Jerry Patterson says Sierra Club sued him to stop Gulf drilling and lost but ‘the turtles are fine’","5th U.S. Circuit Court of Appeals,Associated Press,Gulf of Mexico,Kemp’s ridley,Kemp’s ridleys,National Park Service,North Padre Island,Padre Island National Seashore,Permanent School Fund,Republican,Sea Turtle Restoration Project,Sierra Club,Tamaulipas,Texas Parks and Wildlife Department,U.S. Fish and Wildlife Service,endangered sea turtle,endangered sea turtles,green turtle,sea turtle,shrimp boats,threat. Sea,to return,trawl,trawl net,turtle species","Sierra Club","Energy,Environment","politifact","http://www.politifact.com","http://www.politifact.com/texas/statements/2012/sep/12/jerry-patterson/jerry-patterson-says-sierra-club-sued-him-stop-gul/","English"
"http://data.gesis.org/claimskg/claim_review/5a7817a9-db95-5e3e-a110-898b41a1ae2b","'At $587 apiece, USA would need to bring home about 33.1 BILLION gold medals to pay off our national debt.'",2016-08-09,2,"MIXTURE","Scott Rigell","Rep. Scott Rigell: 33.1 billion Rio Olympic gold medals would pay off U.S. national debt","Brazil,CNN,Facebook,Forbes,Jesse Owens,Kaylin,Medicare,Scott Rigell,Treasury bills,Treasury securities,U.S. Olympic Committee,U.S. Treasury Department,debt held by the public,https,precious metal,the price,track and field","","Debt","politifact","http://www.politifact.com","http://www.politifact.com/virginia/statements/2016/aug/19/scott-rigell/rep-scott-rigell-331-billion-rio-olympic-gold-meda/","English"
"http://data.gesis.org/claimskg/claim_review/67289649-0219-59fc-9ef8-4ab1e88fd982","The U.S. government prohibits high mileage Volkswagen Passat automobiles from being purchased by U.S. customers.","Unknown",1,"FALSE","Unknown","Volkswagen Passat","Bluemotion,Passat,U.S. Environmental Protection Agency,Volkswagen Passat,Volkswagen of America Inc,but not,manual transmission","Volkswagen Passat","ASP Article","snopes","http://www.snopes.com","https://www.snopes.com/fact-check/volkswagen-passat/","English"
"http://data.gesis.org/claimskg/claim_review/af41c5f9-f8fc-5e32-ab66-9ac47985835f","'USAID put $8 billion up and attracted more than $45 billion in a public-private partnership called Power Africa.'",2017-03-01,2,"MIXTURE","David Perdue","Fact-check: Sen. Perdue touts US power program for Africa","Barack Obama,Center for Global Development,David Perdue,Donald Trump,Gayle Smith,Meet the Press Daily,NBC,NBC News,Nigeria,Overseas Private Investment Corporation,Politifact,U.S. Agency for International Development,USAID,buttress,hard money,public-private partnership,solar power,sub-Saharan Africa,the Power,the package","USAID,public-private partnership","Energy,Foreign Policy","politifact","http://www.politifact.com","http://www.politifact.com/global-news/statements/2017/mar/21/david-perdue/sen-perdue-touts-us-power-program-africa/","English"
"http://data.gesis.org/claimskg/claim_review/bfbb13d9-9691-5c50-85d5-ae1dd87d301a","Four in ten fathers will not see their children this Father’s Day due to separation and family breakdown.","Unknown",-1,"OTHER","Unknown",,"","Father’s Day","Home,News","fullfact","https://fullfact.org/","https://fullfact.org/news/fathers-day/","English"
"http://data.gesis.org/claimskg/claim_review/61f538e4-5520-5dee-baa3-91ccbda7ae0b","'The Federal Reserve system has presided over about a 95... percent decline in the U.S. dollar.'",2010-03-11,2,"MIXTURE","Barbara Cargill","Barbara Cargill says the Federal Reserve presided over a 95 percent decline in the U.S. dollar","Alan Greenspan,Ben Bernanke,Brookings Institute,Bureau of Labor Statistics,Consumer Price Index,Federal Open Market Committee,Federal Reserve,Federal Reserve System,Federal Reserve system,Hamermesh,Henry B. Gonzalez,Jesse Benton,Libertarian,Milton Friedman,Monetary policy,Patricia Hardy,Ron Paul,U.S. dollar,University of Texas at Austin,declining dollar,economist,gold standard,inflation,monetary policy,money supply,money, you,the price","Federal Reserve system,U.S. dollar","Economy,Education","politifact","http://www.politifact.com","http://www.politifact.com/texas/statements/2010/mar/22/barbara-cargill/barbara-cargill-says-federal-reserve-presided-over/","English"
"http://data.gesis.org/claimskg/claim_review/f0e73476-1cda-50a3-b43c-d4c176b7945d","A government grant will pay your utility bill in full for one month.","Unknown",-1,"OTHER","Unknown","Utility Bill Payment Scam","Federal Reserve,Federal Reserve bank,Florida Power & Light,Instagram,MSNBC,Metro PCS,Obama Administration,PSE&G,Public Service Electric and Gas Company,give me,identity theft,it, it,routing number","","Identity Theft","snopes","http://www.snopes.com","https://www.snopes.com/fact-check/utility-bill-payment-scam/","English"
"http://data.gesis.org/claimskg/claim_review/00123ab2-cc2e-501e-87bf-bc8339e6648a","Did Voltaire Say, ‘To Learn Who Rules Over You, Simply Find Out Who You Are Not Allowed To Criticize’?","Unknown",-1,"OTHER","Unknown","Did Voltaire Say, ‘To Learn Who Rules Over You, Simply Find Out Who You Are Not Allowed To Criticize’?","1993 radio,Barry Popik,Daily Caller,Guardian,Kevin Alfred Strom,Paul Gibbard,Twitter,University of Western Australia,Voltaire,dailycaller,etymologist,facebook,white nationalist","Voltaire",,"checkyourfact","http://checkyourfact.com","https://checkyourfact.com/2019/10/02/fact-check-voltaire-learn-rule-allowed-criticize/","English"
"http://data.gesis.org/claimskg/claim_review/f7bc9b32-6a16-5181-838b-307a4736a121","'Race is the No. 1 indicator for where toxic and polluting facilities are today.'",2019-04-29,2,"MIXTURE","Beto O'Rourke","Beto O'Rourke says race is No.1 indicator for location of toxic facilities. Is it true?","Beto O'Rourke,Beto O’Rourke,General Accounting Office,Government Accountability Office,Indiana University,Journalist’s Resource,NAACP,PolitiFact,Temple University,United Church of Christ,University at Buffalo,University at Buffalo School of Law,University of Michigan,University of Montana,University.Blacks,climate change,demographics of,environmental justice,environmental racism,hazardous waste,redlining","","Climate Change,Public Health","politifact","http://www.politifact.com","http://www.politifact.com/texas/statements/2019/may/14/beto-orourke/beto-orourkes-climate-change-plan-says-race-no1-in/","English"
"http://data.gesis.org/claimskg/claim_review/608b4ffa-05f4-5906-9019-bdc54417c59a","'We ... sold the state airplanes as I had promised.'",2011-03-08,3,"TRUE","Rick Scott","Gov. Rick Scott says he sold the state planes","Cessna Citation Bravo,J.D. Alexander,Rick Scott,St. Petersburg Times,Washington, D.C","","State Budget","politifact","http://www.politifact.com","http://www.politifact.com/florida/statements/2011/mar/08/rick-scott/gov-rick-scott-says-he-sold-state-planes/","English"
"http://data.gesis.org/claimskg/claim_review/610d09ee-d9b8-5f6b-9f5c-ae1883831831","The Clinton Foundation 'took steps that went above and beyond all legal requirements and, indeed, all standard requirements followed by every other charitable organization.'",2016-08-24,2,"MIXTURE","Hillary Clinton","Did the Clinton Foundation go 'above and beyond' in transparency?","Anderson Cooper,Anthony Clark,Barack Obama,Bill Clinton,Bill and Melinda Gates Foundation,Bush family,CNN,Carter Center,Center for Global Development,Center for Strategic and International Studies,Charity Navigator,Clinton Foundation,Clinton Global Initiative,Council on Foundations,Demand Progress,Donald J. Trump Foundation,Donald Trump,Foundation for Excellence in Education,George W. Bush,Heinz Endowments,Hillary Clinton,Inside Philanthropy,Jeb Bush,Jimmy Carter,John Kerry,John McCain,Kathleen Clark,Marc Rich,Obama administration,Oxfam,Public Citizen,Sunlight Foundation,Teresa Heinz,Washington Post,Washington University in St. Louis,Wikimedia Foundation,World Resources Institute,World Wrestling Entertainment,https,point of, you,private foundation,so you,think tank,word 'foundation","Clinton Foundation","Ethics,Transparency","politifact","http://www.politifact.com","http://www.politifact.com/truth-o-meter/statements/2016/aug/31/hillary-clinton/did-clinton-foundation-go-above-and-beyond-transpa/","English"
"http://data.gesis.org/claimskg/claim_review/84804e02-2146-5510-80c5-01ab286145c8","Says potential GOP U.S. Senate candidate Tommy Thompson supported 'Obamacare'",2011-08-23,2,"MIXTURE","Club for Growth","Club for Growth says potential Republican U.S. Senate candidate Tommy Thompson supported “Obamacare”","Affordable Care Act,Barack Obama,CNBC,Club for Growth,Democrat,Dick Gephardt,Fox News,George W. Bush,Herb Kohl,House majority leader,Huffington Post,Kathleen Sebelius,Labor Day,Let's work together,Milwaukee Journal Sentinel,Missouri,Obamacare,Patient Protection and Affordable Care Act,Republican,Tommy Thompson,U.S. Senate,Washington, D.C,What I’m,White House,argues,bill, Thompson,conservative,health care reform,health care reform bill,health care reform law,ll test,primary election,social safety net","Obamacare,Tommy Thompson,U.S. Senate","Bipartisanship,Health Care,Public Health","politifact","http://www.politifact.com","http://www.politifact.com/wisconsin/statements/2011/aug/31/club-growth/club-for-growth-says-potential-Republican-US-Senat/","English"
"http://data.gesis.org/claimskg/claim_review/0f57cec5-7b3a-5809-8158-03a689a9246f","Message advocates a one-month boycott of Chinese-made goods.","Unknown",2,"MIXTURE","Unknown","Check the Can","","","ASP Article","snopes","http://www.snopes.com","https://www.snopes.com/fact-check/check-the-can/","English"
"http://data.gesis.org/claimskg/claim_review/23dff6a1-84bb-5fbd-88d2-274d4e2ec4c2","The two men dressed in blue uniforms stationed inside the doors of the national assembly “must leave the house. They don’t belong here.”","Unknown",1,"FALSE","Unknown","Ceremonial guards & criminal records: Checking EFF claims about SA parly | Africa Check","2015 State of the Nation address,2016 State of the Nation address,Africa Check,Economic Freedom Fighters,Electoral Commission of South Africa,Jacob Zuma,Mbuyiseni Ndlozi,Ndlozi,Nigeria,Senegal,South Africa,South African air force,South African army,State of the Nation addresses,aides-de-camp,aiguillette,alternative facts,head of state","","government, Jacob Zuma, SONA","africacheck","https://africacheck.org","https://africacheck.org/reports/eff-correct-military-officers-sa-parliaments-door-dont-belong/","English"
"http://data.gesis.org/claimskg/claim_review/98e942ca-dbae-5bb8-9c4f-c2c396b786be","Prince Harry and Meghan Markle’s home renovations cost £2.4 million in taxpayer funds.","Unknown",-1,"OTHER","Unknown",,"","Meghan Markle,Meghan Markle’s,Prince Harry","Home,Economy","fullfact","http://fullfact.org/","https://fullfact.org/economy/frogmore-cottage/","English"
"http://data.gesis.org/claimskg/claim_review/bf6da642-f626-5f87-9264-f2a61b9b08bf","An 81-year-old man named Arthur Hickenlooper competed on the show 'American Ninja Warrior.'","Unknown",1,"FALSE","Unknown","Did 81-Year-Old Arthur Hickenlooper Compete on ‘American Ninja Warrior?’","American Ninja Warrior,Facebook,John Hickenlooper,Leverich,Matt Iseman,Steffensen,Thrillist,cat is out of the bag,viral video,weightlifter","American Ninja Warrior","american ninja warrior","snopes","http://www.snopes.com","https://www.snopes.com/fact-check/arthur-hickenlooper-81-american-ninjaj-warrior/","English"
"http://data.gesis.org/claimskg/claim_review/e802bf4c-c2c0-50ae-9a6b-0a7f2892004f","Urban Outfitters CEO Richard Hayne donated money to Rick Santorum and opposes gay marriage and abortion.","Unknown",2,"MIXTURE","Unknown","Richard Hayne","BHLDN,Clothes Make the Man,Forbes,I Support Same Sex Marriage,Philadelphia Weekly,Republican,Richard Hayne,Rick Santorum,Same Sex Marriage,Same-Sex Marriage,Twitter,United States of Love,Urban Outfitters,Washington Post,abortion,bisexual,gay marriage,lesbian,the Chairman,transgender,transvestism","Richard Hayne,Rick Santorum,Urban Outfitters","ASP Article","snopes","http://www.snopes.com","https://www.snopes.com/fact-check/richard-hayne/","English"
"http://data.gesis.org/claimskg/claim_review/8b083cf1-de99-5254-96b8-e403c2ad48d4","'97 percent of the work that Planned Parenthood does is about mammograms and preventative health.'",2015-07-26,2,"MIXTURE","Martin O'Malley","97% of Planned Parenthood's work is mammograms, preventive care, O'Malley says","Dave Weigel,Martin O’Malley,Planned Parenthood,STD,STD testing,Washington Post,abortion,anti-abortion,birth control,but not,contraception,contraception and cancer,mammogram,preventive care","Planned Parenthood","Abortion,Public Health","politifact","http://www.politifact.com","http://www.politifact.com/truth-o-meter/statements/2015/aug/03/martin-omalley/97-planned-parenthoods-work-mammograms-preventive-/","English"
"http://data.gesis.org/claimskg/claim_review/febda5a0-387c-5ba5-a19a-b593fd8f46a7","Obama Thanks Muslims for Their Contribution to U.S.A.","Unknown",3,"TRUE","Unknown","Obama Thanks Muslims for Their Contribution to U.S.A.-Truth!","Muslim,Ramadan,Rich Buhler,White House,here at home,jQuery","",,"truthorfiction","https://www.truthorfiction.com","https://www.truthorfiction.com/obama-thanks-muslims/","English"
