"id","text","date","truthRating","ratingName","author","headline","named_entities_claim","named_entities_article","keywords","source","sourceURL","link","language"
"http://data.gesis.org/claimskg/claim_review/4cc7845c-c421-5f5a-9562-4b8bc8c5b212","'US representatives promise implement of UN gun-control plans'",2018-07-05,2,"MIXTURE","Bloggers","Conservative website wrong on effects, purpose of UN conference","Cato Institute,Facebook,Nikki Haley,PolitiFact,Tenth Amendment,U.N. Office for Disarmament Affairs,United Nations,chain email,https","","Crime,Fake news,Guns","politifact","http://www.politifact.com","http://www.politifact.com/punditfact/statements/2018/jul/10/blog-posting/conservative-website-wrong-purpose-effects-un-conf/","English"
"http://data.gesis.org/claimskg/claim_review/3261517e-6d0c-5bc1-80e0-e460d75b6a78","Says U.S. Sen. Ron Johnson 'voted to cut $700m from Medicare.'",2015-06-11,2,"MIXTURE","MoveOn.org","MoveOn.Org says Ron Johnson voted to cut $700 million from Medicare","Affordable Care Act,Barack Obama,Chile,Congressional Budget Office,Facebook,Medicare,Mexico,MoveOn,MoveOn.org,New Zealand,Obamacare,PolitiFact,Ron Johnson,Russ Feingold,Singapore,Trade Adjustment Assistance,Trans-Pacific Partnership,Vietnam,argues","Medicare,Ron Johnson,Sen,U.S. Sen","Federal Budget,Medicare,Trade","politifact","http://www.politifact.com","http://www.politifact.com/wisconsin/statements/2015/jul/01/moveon/moveonorg-says-ron-johnson-voted-cut-700-million-m/","English"
"http://data.gesis.org/claimskg/claim_review/fef96ea1-027b-5c91-aa36-ddec33fd5355","'(Brendan) Doherty wants to raise the eligibility age for Social Security benefits for anyone born after 1960, with no regard for the challenges it would cause for people working in physically demanding occupations.'",2012-08-09,1,"FALSE","David Cicilline","U.S. Rep. David Cicilline says Republican Brendan Doherty wants to raise Social Security eligibility age without regard for workers in physically demanding jobs","Alan Simpson,Bill Clinton,Brendan Doherty,David Cicilline,Democrat,Erskine Bowles,Facebook,National Commission on Fiscal Responsibility and Reform,PolitiFact,President Obama,Republican,Rhode Island State Police,Simpson-Bowles commission,Social Security trust fund,Twitter,White House chief of staff,Wyoming","","Federal Budget,Health Care,Medicare,Social Security","politifact","http://www.politifact.com","http://www.politifact.com/rhode-island/statements/2012/aug/15/david-cicilline/says-brendan-doherty-wants-raise-social-security-e/","English"
"http://data.gesis.org/claimskg/claim_review/f07828e1-1373-54c1-ad1f-d4180b296b65","Taxypayers paid $4 million for President Obama to play golf with Tiger Woods.","Unknown",2,"MIXTURE","Unknown","Obama Golf Outing with Tiger Woods Cost Nearly $4 Million?","2013 “golf,89th Airlift Wing,Air Force One,Air Mobility Command,Chicago, Illinois,Committee on Environment and Public Works,DHS,Department of Defense,Department of Homeland Security,Florida; White House,Government Accountability Office,Hyde Park,John Barrasso,Joint Base Andrews,Marine Corps Base Quantico,Maryland,New Jersey,Pentagon,Quantico, Virginia,Scott Air Force Base,Secret Service,Senate Committee on Environment and Public Works,State of the Union address,Subcommittee on Transportation and Infrastructure,Tiger Woods,U.S. Coast Guard,U.S. Secret Service,White House,Wyoming","Tiger Woods","gao, john barrasso, president obama, tiger woods, washington times","snopes","http://www.snopes.com","https://www.snopes.com/fact-check/obama-golf-outing-with-tiger-woods/","English"
"http://data.gesis.org/claimskg/claim_review/84f40e14-116a-5fb2-8803-5d04db25fa1a","On directing the attorney general to withdraw Wisconsin from pre-existing conditions lawsuit.",2019-01-23,-1,"OTHER","Tony Evers","Gov. Tony Evers reverses position on pulling Wisconsin from Obamacare lawsuit","2018 election,Affordable Care Act,Baldauff,Democrat,Josh Kaul,Obamacare,PolitiFact,Republican,Scott Walker,Tony Evers,Wisconsin,applause line,the power","","Health Care,Legal Issues,States","politifact","http://www.politifact.com","http://www.politifact.com/wisconsin/statements/2019/jan/26/tony-evers/gov-tony-evers-reverses-position-pulling-wisconsin/","English"
"http://data.gesis.org/claimskg/claim_review/abc0d671-3afb-565d-80f3-4cc746e28c8d","The missiles displayed during a North Korean military parade were fake.","Unknown",-1,"OTHER","Unknown","Did North Korea Display Fake Missiles During a Military Parade?","2017, North Korea,Kim Il-Sung,Lowy Institute for International Policy,North Korea,Pyongyang","","north korea","snopes","http://www.snopes.com","https://www.snopes.com/fact-check/north-korea-fake-missiles/","English"
"http://data.gesis.org/claimskg/claim_review/fdee04ca-96cd-540e-87e9-f5dbb5aca9ee","Warren Buffett says stop Obamacare now and start over.",2013-09-22,1,"FALSE","Tom Graves","Rep. Graves wrong about Buffett's health law stance","ABC,ABC News,Affordable Care Act,Barack Obama,Berkshire Hathaway,Berkshire Hathaway Inc,CNBC,Chicago Tribune,FactCheck.org,Georgia,Obamacare,Omaha World-Herald,PolitiFact,Politico,Republican,Tom Graves,Wall Street Journal,Warren Buffett,Washington Examiner,Weekly Standard,it. It,to show","Warren Buffett","Health Care","politifact","http://www.politifact.com","http://www.politifact.com/georgia/statements/2013/sep/27/tom-graves/rep-graves-wrong-about-buffetts-health-law-stance/","English"
"http://data.gesis.org/claimskg/claim_review/c57644b9-a34e-50d1-9443-d5005b3da9d4","Did George Eliot Say, ‘It’s Never Too Late To Be What You Might Have Been’?","Unknown",-1,"OTHER","Unknown","Did George Eliot Say, ‘It’s Never Too Late To Be What You Might Have Been’?","Adelaide Anne Procter,Boston College,Daily Caller,Daniel Deronda,George Eliot,Middlemarch,Oscar Wilde,Quote Investigator,Twitter,dailycaller,facebook","George Eliot",,"checkyourfact","http://checkyourfact.com","https://checkyourfact.com/2019/08/28/fact-check-george-eliot-never-late-might-have-been-quote/","English"
"http://data.gesis.org/claimskg/claim_review/96541868-49cd-5e38-93f3-fe1a1b62f790","The Obama Administration is suing a Wisconsin company for forcing employees to speak English.",2014-07-02,2,"MIXTURE","Bloggers","Bloggers claim the feds sued a company for requiring workers to speak English","Civil Rights Act of 1964,Equal Employment Opportunity Commission,Fox News,Hispanic,Hmong,Judicial Watch,Obama Administration,Philippines,PolitiFact,Title VII,Title VII of the Civil Rights Act of 1964,argues,performance improvement plan,we’re not here","","Labor,Workers","politifact","http://www.politifact.com","http://www.politifact.com/wisconsin/statements/2014/jul/20/blog-posting/bloggers-claim-feds-sued-company-requiring-workers/","English"
"http://data.gesis.org/claimskg/claim_review/fb0c1678-b91a-5ab8-8afb-204c82ebc324","'It’s been 14 years since a president or a vice president or a member of their family has not gone and attended at least an event at the Olympics.'",2014-02-09,3,"TRUE","Candy Crowley","CNN's Candy Crowley says it's unusual for a president or their family not to attend the Olympics","2000 Summer games,Al Gore,Athens,Australia,Barbara Bush,Beijing,Bill Clinton,Billie Jean King,CNN,Candy Crowley,George H. W. Bush,George W. Bush,Greece,Janet Napolitano,Japan,Nagano,Russia,Salt Lake City,Salt Lake City, Utah,Sochi,Sydney,Tipper Gore,Vladimir Putin,White House,beach volleyball,behind the make-up","","Sports","politifact","http://www.politifact.com","http://www.politifact.com/punditfact/statements/2014/feb/09/candy-crowley/cnns-candy-crowley-says-its-unusual-president-or-t/","English"
"http://data.gesis.org/claimskg/claim_review/ab0efcea-b26a-5e88-8603-b59522ccb920","If the Sellwood Bridge is not replaced, it will have to be shut down within eight years.",2011-03-29,2,"MIXTURE","Charlotte Lehan","Will Sellwood Bridge have to be shut down in eight years if it is not replaced?","22 million,Clackamas County,David Evans,Highway 43,I-205,Interstate 205,Mike Baker,Multnomah County,PolitiFact,Ross Island,Sellwood Bridge,TriMet","Sellwood Bridge","Transportation","politifact","http://www.politifact.com","http://www.politifact.com/oregon/statements/2011/may/14/charlotte-lehan/will-sellwood-bridge-have-be-shut-down-eight-years/","English"
"http://data.gesis.org/claimskg/claim_review/585e4e52-5035-58ce-9066-a029349f3a43","Says Ted Cruz said, 'When gays stayed hidden we had no mass shootings; we had no public nudity. Society was polite. Now anything and everything goes and I blame them.'",2015-02-16,1,"FALSE","Viral image","Ted Cruz didn’t blame gay people for mass shootings and public nudity","Beto O’Rourke,Democrat,Facebook,PolitiFact,Political Action Committee,Teabaggers,Ted Cruz,Texas Senate,https,meme,pbs,public nudity,same-sex marriage,the speech","Ted Cruz,public nudity","Gays and Lesbians","politifact","http://www.politifact.com","http://www.politifact.com/facebook-fact-checks/statements/2018/sep/17/viral-image/ted-cruz-didnt-blame-gay-people-mass-shootings-and/","English"
"http://data.gesis.org/claimskg/claim_review/fd1e15bf-4e62-536c-8f29-06238f4e32ae","Some German states have banned Red Bull’s ‘Simply Cola’ drink after claiming it contains trace amounts of cocaine.","Unknown",3,"TRUE","Unknown","Red Bull Cocaine","Agence France Presse,Associated Press,Coca-Cola,Cocaine,Federal Institute for Risk Assessment,Hong Kong,Red Bull,Red Bull Cola,Red Bull Simply Cola,Red Bull: Cola,Simply Cola,St. Petersburg Times,Wall Street Journal,cocaine","Red Bull,Simply Cola,cocaine","ASP Article, potent potables","snopes","http://www.snopes.com","https://www.snopes.com/fact-check/bull-snort/","English"
"http://data.gesis.org/claimskg/claim_review/4b4f4708-44cd-5f86-bb99-71b20e643655","'I never was in favor of shutting down the government. … (I) voted to fund the government fully.'",2013-10-20,2,"MIXTURE","Marco Rubio","Marco Rubio says he never favored a government shutdown and voted to fully fund the government","Barack Obama,Chris Wallace,Fox News,Fox News Sunday,Greta Van Susteren,House-Senate conference,Marco Rubio,Veterans for America,Weekly Standard,bicameral,individual mandate,it takes two,takes two to tango","","Federal Budget,Health Care","politifact","http://www.politifact.com","http://www.politifact.com/truth-o-meter/statements/2013/oct/23/marco-rubio/marco-rubio-says-he-never-favored-government-shutd/","English"
"http://data.gesis.org/claimskg/claim_review/1f28a222-94fc-57df-9d05-a4836c128089","'Oregon’s per capita income is 9 percent below the national average and getting worse. This is a state that’s actually getting poorer.'",2012-01-02,2,"MIXTURE","Matt Wingard","Is Oregon’s per capita income nine percent below the national average -- and does that mean we’re getting poorer?","Matt Wingard,Oregon Center for Public Policy,Oregon Employment Department,Per capita personal income,PolitiFact,Wilsonville,argues,but not,per capita income,per capita personal income,post at,what do we know","per capita income","Economy,Income,Jobs,Poverty,Workers","politifact","http://www.politifact.com","http://www.politifact.com/oregon/statements/2012/jan/06/matt-wingard/oregons-capita-income-nine-percent-below-national-/","English"
"http://data.gesis.org/claimskg/claim_review/59662f74-0020-5a2e-a76b-883eda614244","A photograph shows Norwegian police officers in their skintight Summer uniforms.","Unknown",1,"FALSE","Unknown","Is This What Police Uniforms in Norway Look Like?","Facebook,Flickr,Norway,Oslo,the internet","","Norway, norwegian police, police uniforms","snopes","http://www.snopes.com","https://www.snopes.com/fact-check/norwegian-police-officers/","English"
"http://data.gesis.org/claimskg/claim_review/fedcee5e-c99e-556d-b875-c5507954c7e2","Cesar Sayoc is a Democrat posing as a Republican.",2018-10-26,1,"FALSE","Bloggers","Pipe bomb suspect's Florida voting records show only Republican affiliation","2016 general election,Democrat,Donald Trump,Facebook,False flag,Miami-Dade County,PolitiFact,Republican,Republican Party,Republican Party of Florida,Social Security number,Washington Post,pipe bomb","Republican","Fake news","politifact","http://www.politifact.com","http://www.politifact.com/facebook-fact-checks/statements/2018/nov/05/blog-posting/pipe-bomb-suspects-florida-voting-records-show-onl/","English"
"http://data.gesis.org/claimskg/claim_review/271cde71-7324-5e83-9688-ed829d9a78e6","'Former President Bill Clinton and his Clinton Health Access Initiative (CHAI) distributed ‘watered-down’ HIV/AIDS drugs to patients in sub-Saharan Africa.'",2016-09-19,1,"FALSE","Daily Caller","Conservative website wrongly ties Clinton Foundation to bad HIV/AIDS drugs","Africa Check,Bill Clinton,Clinton Foundation,Clinton Health Access Initiative,Daily Caller,Doctors Without Borders,Ellen 't Hoen,Food and Drug Administration,HIV/AIDS,Lyndsay Meyer,Marsha Blackburn,Medicines and Healthcare Products Regulatory Agency,PolitiFact,Republican,South Africa,The price,U.S. Food and Drug Administration,World Health Organization,acne,drug recall,epilepsy,generic drug,https,sub-Saharan Africa,the price,what do we know","Bill Clinton,Clinton Health Access Initiative,HIV/AIDS,sub-Saharan Africa","Consumer Safety,Corrections and Updates,Public Health","politifact","http://www.politifact.com","http://www.politifact.com/global-news/statements/2016/sep/23/daily-caller/conservative-website-wrongly-ties-clinton-foundati/","English"
"http://data.gesis.org/claimskg/claim_review/4123d429-d09d-5533-85de-069cd88916ab","Parking lot carjackers are placing flyers or $100 bills on the windows of automobiles, then taking the cars when drivers step out of their vehicles to remove them.","Unknown",1,"FALSE","Unknown","Are Carjackers Leaving Flyers and $100 Bills on Car Windows?","Alberta,Florida Highway Patrol,Florissant Police Department,Florissant, MO,Illinois State Police,Louisiana State Police,Montgomery County,Montgomery County Sheriff’s Office,NZ Police,New Zealand Police,So, you,St. Louis County,St. Louis County, Missouri,Then you,Wal-Mart,Washington, D.C,Wetaskiwin,car jacked,carjacking,crimes of opportunity,it. “It,signature block,snopes,the Internet,the staff,to return,urban myth,view …nowhere","","carjacking, crime warnings","snopes","http://www.snopes.com","https://www.snopes.com/fact-check/carjackers-leaving-flyers-100-bills-car-windows/","English"
"http://data.gesis.org/claimskg/claim_review/739f8d84-4a7a-5c51-b7f0-61e5337a3cb8","Judging by a recent vote, Rep. Debbie Wasserman Schultz 'thinks it's okay for medical marijuana patients to go to federal prison.'",2014-06-05,2,"MIXTURE","Americans for Safe Access","Ad says Debbie Wasserman Schultz wants to send medical pot users to prison","Access group,Alabama,Alaska,Americans for Safe Access,Andy Harris,Angel Raich,Arizona,Barack Obama,California,Colorado,Commerce Clause,Connecticut,Controlled Substances Act,Controlled Substances Act of 1970,DEA,Dana Rohrabacher,Debbie Wasserman Schultz,Delaware,Democratic National Committee,District of Columbia,Florida,George Mason University,Gonzales vs. Raich,Hawaii,Illinois,Ilya Somin,Iowa,Kentucky,Kettle Falls,Kettle Falls Five,Larry Harvey,Maine,Maryland,Massachusetts,Michigan,Mikos,Minnesota,Mississippi,Missouri,Montana,Nevada,New Hampshire,New Jersey,New Mexico,Ohio State University,Oregon,PolitiFact,Press Enterprise,Rhode Island,Schedule I drug,South Carolina,TODAY Network,Tennessee,U.S. Deputy Attorney General,U.S. Drug Enforcement Agency,U.S. Supreme Court,USA TODAY,Utah,Vermont,Wisconsin,a bad,amendment.'I,argues,cannabis,https,marijuana,marijuana,' Ohio,medical marijuana,misdemeanor,organ transplant,senior citizen","Debbie Wasserman Schultz,medical marijuana","Crime,Criminal Justice,Drugs,Marijuana","politifact","http://www.politifact.com","http://www.politifact.com/florida/statements/2014/jun/10/americans-safe-access/ad-says-debbie-wasserman-schultz-wants-send-medica/","English"
"http://data.gesis.org/claimskg/claim_review/0eb84580-0a46-5f17-9480-e4e82f86504a","About 106,000 soldiers had 'a prescription of three weeks or more' for pain, depression or anxiety medication.",2010-08-08,3,"TRUE","Gen. Peter Chiarelli","U.S. Army report documents problem of suicides in the military.","Peter Chiarelli,SSRIs,Selective Serotonin Reuptake Inhibitors,Serotonin,This Week with Christiane Amanpour,anti-anxiety drugs,antidepressant,hucking,opiate,prescription drug","anxiety","Health Care,Military,This Week - ABC News","politifact","http://www.politifact.com","http://www.politifact.com/truth-o-meter/statements/2010/aug/10/gen-peter-chiarelli/us-army-report-documents-problem-suicides-military/","English"
"http://data.gesis.org/claimskg/claim_review/7f3f5e8e-0374-5a53-8574-40b675faaf78","Says first eight chosen to draw Austin City Council districts are seven Democratic primary voters and one Republican primary voter.",2013-05-22,3,"TRUE","Derek Ryan","Derek Ryan says first 8 chosen to draw Austin City Council districts are 7 Democratic primary voters, 1 GOP primary voter","2007 general election,Art Lopez,Democrat,Derek Ryan,Huffington Post,Jeff Smith,Republican,Republican?' Party,Terry Keel,Texas secretary of state,Travis County,commission members,primary election,will know","Republican","City Government,Corrections and Updates","politifact","http://www.politifact.com","http://www.politifact.com/texas/statements/2013/jun/04/derek-ryan/derek-ryan-says-first-8-chosen-draw-austin-city-co/","English"
"http://data.gesis.org/claimskg/claim_review/bf26c389-b5fb-5d18-9162-08c76ec12fd2","Aid given a child helps him buy a doll and a white rose as gifts for his dead sister and his dying mother, both victims of a drunk driver.","Unknown",-1,"OTHER","Unknown","White Rose","C.W. McCall,Hurricane Rita,Louisiana,Pledge of Allegiance,Roses for Mama,bird flu,but not,one for the road,s scale,the Internet","","ASP Article","snopes","http://www.snopes.com","https://www.snopes.com/fact-check/white-rose/","English"
"http://data.gesis.org/claimskg/claim_review/0c39415d-c8bf-51e6-8f53-28543ac26cc0","Donald Trump Jr. tweeted that the family's greenskeeper missed his own sister's wedding in order to work for the Trumps.","Unknown",3,"TRUE","Unknown","Donald Trump Jr.: Our Greenskeeper Skipped His Sister’s Wedding","Donald Trump,Donald Trump Jr,Republican","Donald Trump Jr","2016 presidential campaign, donald trump, donald trump jr., republicans","snopes","http://www.snopes.com","https://www.snopes.com/fact-check/donald-trump-jr-tweet/","English"
"http://data.gesis.org/claimskg/claim_review/bddcc091-642a-53cd-8bad-a484a87d5618","'I'm the only candidate on this stage who has actually cut taxes.'",2018-02-10,1,"FALSE","Joel Giambra","Is Giambra the only GOP candidate for NY governor who's cut taxes?","Andrew M. Cuomo,Erie County,George E. Pataki,Joel Giambra,John A. DeFrancisco,PolitiFact,Republican,estate tax,property tax,sales tax","","Taxes","politifact","http://www.politifact.com","http://www.politifact.com/new-york/statements/2018/feb/28/joel-giambra/giambra-only-gop-candidate-ny-governor-whos-cut-ta/","English"
"http://data.gesis.org/claimskg/claim_review/96a53d35-2983-5f4a-a2c1-5132fa48d7db","'A couple of hundred American cities are infested by members of the Mexican cartels.'",2011-06-07,3,"TRUE","Michael Cutler","Immigration expert says hundreds of U.S. cities have been infiltrated by Mexican cartel members","Californians for Population Stabilization,Facebook,Felipe Calderon,Fitchburg, Mass,Greenville, N.H,Helen Glover,Immigration and Naturalization Service,Janet Napolitano,Mexico,National Drug Intelligence Center,North Kingstown,PolitiFact,Roberta Jacobson,Threat Assessment,Twitter,U.S. Justice Department,WHJJ,cocaine,gangs in the United States,racketeering","","Crime,Drugs,Homeland Security","politifact","http://www.politifact.com","http://www.politifact.com/rhode-island/statements/2011/jun/19/michael-cutler/immigration-expert-says-hundreds-us-cities-have-be/","English"
"http://data.gesis.org/claimskg/claim_review/4fe768d3-cf45-5e0b-8d22-2692a22e17b9","'Last year, (Bill McCollum) spent more than $2.2 million dollars to produce and air campaign-style TV ads where you were featured in almost every frame.'",2010-05-18,2,"MIXTURE","Florida Democratic Party","Florida Democrats accuse Bill McCollum of reckless spending","2.2 million,Bill McCollum,Florida Attorney General,Florida Democratic Party,Florida Democratic party,George Rekers,Karen Thurman,National Association for Research & Therapy of Homosexuality,flushed away,no-bid contract","2.2 million,Bill McCollum","Children,Crime,Technology","politifact","http://www.politifact.com","http://www.politifact.com/florida/statements/2010/may/25/florida-democratic-party/florida-democrats-accuse-bill-mccollum-reckless-sp/","English"
"http://data.gesis.org/claimskg/claim_review/900263dd-8164-5385-94dc-e5fb3bcd2265","A recent international investigation resulted in the shutting down of an online pedophilia forum with some 70,000 members worldwide.","Unknown",2,"MIXTURE","Unknown","Was a Massive Pedophile Ring with ‘70,000 Elite Members’ Busted by Police?","European Union,Europol,NBC News,Operation Rescue,boylover,child abuse,fake news,fake news site,internet Pedophile,online pedophile,pedophile","pedophilia","neon nettle","snopes","http://www.snopes.com","https://www.snopes.com/fact-check/70000-pedophile-ring-busted/","English"
"http://data.gesis.org/claimskg/claim_review/dea8056d-8ceb-570e-b69d-5af30dc760f1","'Remember after the shooting in Las Vegas, (President Donald Trump) said, ‘Yeah, yeah, we’re going to ban the bump stocks.’ Did he ban the bump stocks? No.'",2019-06-02,1,"FALSE","Kirsten Gillibrand","Kirsten Gillibrand wrong about Donald Trump and bump stocks","AR-15,ATF,Bump stocks,Bureau of Alcohol, Tobacco, Firearms and Explosives,Chris Wallace,Donald Trump,Fox News,Kirsten Gillibrand,Las Vegas,Matthew Whitaker,National Rifle Association,Republican Party,Trump administration,University of Central Florida,Virginia Beach,bump stock,bump stocks,but not,club in,federal Bureau of Alcohol, Tobacco, Firearms,s expression,semi-automatic rifle,semiautomatic firearm","Donald Trump,Las Vegas","Guns","politifact","http://www.politifact.com","http://www.politifact.com/truth-o-meter/statements/2019/jun/06/kirsten-gillibrand/kirsten-gillibrand-wrong-about-donald-trump-and-bu/","English"
"http://data.gesis.org/claimskg/claim_review/f0674355-71c3-5417-b141-6bbfb2187c15","Says Florida U.S. Reps. Corrine Brown, Alcee Hastings and Frederica Wilson are Socialists.",2011-08-12,1,"FALSE","Bloggers","Bloggers say U.S. Reps. Corrine Brown, Alcee Hastings and Frederica Wilson are openly serving as Socialists","111th Congress,112th Congress,Alcee Hastings,Andre Carson,Bernie Sanders,Congressional Progressive Caucus,Corrine Brown,David Bonior,Democrat,Democratic Socialists of America,Florida Democratic Party,Frederica Wilson,Henry Lamb,John Conyers,Maxine Waters,Oregonian,PolitiFact,Red Scare,Ron Dellums,Socialist Party of America,U.S. Congress,blogosphere,but not,civil rights,democratic socialist,is alive,magic number,right answer,to show","Alcee Hastings,Corrine Brown,Florida,Frederica Wilson","Patriotism","politifact","http://www.politifact.com","http://www.politifact.com/florida/statements/2011/sep/02/blog-posting/us-reps-corrine-brown-alcee-hastings-and-frederica/","English"
"http://data.gesis.org/claimskg/claim_review/f89282e7-b48c-5c30-86f5-3d52ef0f142c","Photograph shows a satellite view of a blackout in eastern North America.","Unknown",1,"FALSE","Unknown","North American Blackout","Air Force Weather Agency,EDT,Eastern Daylight Time,Eastern Standard Time,Eastern Time,GeoStar,Greenwich Mean Time,Hurricane Sandy,NOAA,National Oceanic & Atmospheric Administration,great blackout of 2003,obscured by clouds,power outage,storm-swept,the power","","2003 blackout, space","snopes","http://www.snopes.com","https://www.snopes.com/fact-check/blackout-2/","English"
"http://data.gesis.org/claimskg/claim_review/1e554442-f271-5f23-a933-492b7cf381c3","Says JoAnne Kloppenburg 'has told us she thinks it's her job to promote a more equal society.'",2016-03-21,2,"MIXTURE","Rebecca Bradley","Did JoAnne Kloppenburg say her job as a judge is to 'promote a more equal society'?","GOP Gov,JoAnne Kloppenburg,One Wisconsin Now,Rebecca Bradley,Republican Party,Ruth Bader Ginsburg,Scott Walker,Sonia Sotomayor,U.S. Constitution,U.S. Supreme Court,Wisconsin Public Radio,Wisconsin Supreme Court,check and balance,conservative","JoAnne Kloppenburg","Candidate Biography,Legal Issues,Supreme Court","politifact","http://www.politifact.com","http://www.politifact.com/wisconsin/statements/2016/mar/30/rebecca-bradley/did-joanne-kloppenburg-say-her-job-judge-promote-m/","English"
"http://data.gesis.org/claimskg/claim_review/eb24a2fc-712a-5fa5-b670-ab3c24bd5aff","The church Barack Obama belongs to only admits black people.",2008-01-06,1,"FALSE","Chain email","Any race may join Chicago church","Barack Obama,Dwight Hopkins,Trinity United Church of Christ,University of Chicago","Barack Obama","Religion","politifact","http://www.politifact.com","http://www.politifact.com/truth-o-meter/statements/2008/jan/11/chain-email/any-race-may-join-chicago-church/","English"
